post,tags
very good,2
I mean really? all these positive reviews for what? our group was bored after the second or third game...,2
Not polite,2
"It's really easy to play, and can be incredibly hilarious. Best played while under the influence of alcohol, in a large group of uncouth rogues.EDIT:I'm changing my review from 4 stars, to 2. I had a lot of fun with this at first, but it lost it's luster for me very quickly.This game is hilarious the first few times you play it, but got old for me real fast. It essentially boils down to whoever gets the nastiest card wins the round, regardless of context.It will always be fun to watch people reading cards for the first time, but I don't think I'll ever voluntarily play this game again.",2
"They are a cheep knock off. The still shuffle ok, but beware of any drink rings. These are like paper towels.",2
Let me say there is nothing whatsoever wrong with this card game -- it's just that I didn't look carefully and purchased it for family get-togethers.  My young-adult kids were hysterical with laughter when they saw it.  It's absolutely filthy dirty stuff -- not family fare.  Great for young adults.  People over 50 looking for fun group games just pass on this one.,2
"I thought it would be fun, but it's a little too gross for me!",2
"Truly a game made for it's shock value.  Definitely an adult's only game which some players enjoyed, myself not included as I found some content disturbing.  Will be reselling this game on Amazon.",2
"I'd liken this game to a teenager learning to drive a car.  Fun for them at first but gets old quickly.  I enjoyed my first time playing Cards Against Humanity but it got old quickly.  The problem with this game is that the dirtiest played card always seems to win no matter what the topic is so the people I've played with ALWAYS play their dirtiest card.  In addition, the game lacks replayability within the same group because their is a limit to the number of cards and topics.  Combine these two elements and you have a board game you can only play a couple of times with any sort of enthusiasm.  If you have the same circle of friends and are looking for a party game, I'd suggest looking at something else.",2
"This product is hilarious and great for parties! I‰Ûªve played Cards Against Humanity with friends and I always wanted to own my own for when I am the host in my own home. The package was delivered in a timely manner. However, some of the cards were damaged within the box and torn on the corners. It was not damaged in shipping as the outside of the box was pristine. I would recommend to anyone buying this product to go in person and buy it in a store to ensure that the product is not damaged.",2
The package arrived timely. However  this card game was more inappropriate than I expected. I was expecting it to be somewhat inappropriate from the reviews I read but it contained much more sexual questions and content that I expected.  I thought I researched enough but it was partly  my fault for not reviewing more information. In the proper setting and group these questions may be funny but not for a family.  I would not let my 17 yr old son play this game and did not want to play with my inlaws or mother!  My 23 yr old son may find it funny with his group of friends.  Just beware it includes alot of sexual content before your purchase.,2
Three generations of Texas women around the kitchen table...only had to hit wiki twice.  Otherwise we were attempting to make our answers make logical and logistics sense.  Not fun if you have these conversations with ease. But we did find the generation gap...come on 20 millennials catch up!! If they were play keys house parties in the 60's.,2
Bought it and played once and never again. Did not like the game.,2
Not as fun as I thought it would be.,2
It was okay box kind of damaged and some cards were missing but overall ok experience,2
"This game is geared more for college aged kids, very sexually oriented.",2
I heard so much good things about this game. But it was missing so many cards the box was basically empty,2
"Played this game for the first time on New Year's.  Some of the cards are extremely inappropriate, I expected that and generally those are the most humorous. We played with 4 people, there seemed to be a lot of dead time. At several points we decided to ditch an agreed amount of cards for fresh ones because they sucked so bad. Also at several points we decided to scrap the round because none of the cards were funny.  Game should come with some blank cards allowing players to create some of their own. 25$ is highway robbery for this glorified set of cards, and honestly I will probably never play again.",2
Wish I had looked at this more closely.  Age advisory says 17+ but I'd say 21+ (or older) is more like it.  Some of the white cards are REALLY off-color.  Seems like this deserves a warning label of some kind.,2
Revived my box and it was literally crushed.,2
This game is definitely not for people under 18 or not even under 21.  A lot of vulgarity.  It should be listed as Adults only.,2
"Loses its appeal quickly. We were neither overly entertained, nor shocked.",2
Don't understand how this has gotten so many 5 star ratings.,2
"Um, not what I thought it was. I'm a little embarrassed that I even purchased it. Rude, graphic, and over-the-toplanguage. I might have thought this was a great game for a frat party, but too many years have passed since then.",2
bought for a kid across the street.....stupid,2
Game is awesome. However. My box came damaged. Totally broken.,2
I wish there was a 2 player version,2
Get the new editions.  These cards are basically rated PG,2
"The quality of the cards is very good.  Box is sturdy.  The idea for the game is interesting.  I'm just not a fan of the game.  It's definitely a game for teens and/or 20 something age range.  Although beware, many of the cards have very adult material.  It can be a little shocking and sick.  I think the developers intended that.  Once you get past that, there is really not much substance to the game and it becomes quite boring.  I don't think the add on's are worth the extra money you spend.  The main game isn't worth the money either.  The game is very subjective as the person judging is doing so in a completely subjective fashion, usually simply based on their own personal perspectives.  I think it is a fad.  Keep in mind, the seller is good and the product quality is fine.  It's the game itself that my review is based on.",2
"Order this product on a Monday,selected the two day shipping option, and it is set to arrive on Friday, this is not two days. If you're wanting it in two days I wouldn't recommend buying it, but this is an extremely fun game if you're into crude humor. Do not buy this for your younger kids",2
"I received my item today, and it is what I ordered. However, the box has been cut all the way through on one side. Cards can slip out of it. I didn't pay $20+ for a card game for the box to be messed up and cards to get lost.",2
"The cards in this box, really are not up to par. You should order a few expansion packs to go with this.",2
Some of the answers are demeaning to humans.,2
Not for kind at heart,2
It got old after a couple play throughs.,2
Worth a few laughs once or twice. We took it with us on a trip to try with friends. We left it there. Expensive for a few marginal laughs.,2
Love the game but box came damaged and now it's hard to store.,2
I'm just not a fan of this game after trying it out... gave it to my sister.  Cards looked used and damaged.,2
"Product was damaged when it arrived it looked like the box was dropped, hard to fit the cards back in",2
This game is funny the first few times but definetly gets boring really fast. Definetly overpriced as well,2
This came a week after expected. That's why rating is low.,2
"My brother, (whom this was bought for) wanted a set and so I purchased them for him, and as you might imagine, I was a little upset to find that this is one box, not two as shown in the photo. Had I known that, I would have purchased one of the others that are only $10. Personally, I feel a bit cheated, but I suppose there's nothing to do but take it as it is.I had a chance to play with my brother and I think the game itself is quite fun, addictive, and plain hilarious. It let's you know how twisted you truly are. I would have rated this higher, but adding my comment above, my palate has been tainted a bit, after this experience.",2
"Horrible, nasty game!",2
"Maybe it was who I was playing with, but this game was not as exciting as I thought it was going to be.",2
"The game is great, but some of the cards were damaged. not happy about that.",2
Too vulgar. Could be very funny without going to that extent.,2
the box damage!!!!,2
"The game is as advertised but many of the questions seemed useless.  I would not repeat, Not recommended",2
I was happy with it but I was not happy that the box was almost completely destroyed when I got it. Like it had been thrown around and crushed by bigger stuff.,2
"We loved the game the first 3 times we played it, but it got old fast. There are just too many cards that are garbage that people use just to get rid of them or don't play because they just aren't funny or fitting of the category. Some of my friends still enjoy the game and they ask to play it sometimes, but it's not something I ever suggest anymore",2
Funny until the cards go really south!  I wish I would have researched this a bit more prior to purchasing.,2
It was good but not nearly as great as the reviews and all the talk about how fun and funny it was to play!,2
If you like drunken party games,2
This is a very fun game but there are a few cards that will literally turn your stomach and say ‰ÛÏWhy?!!‰Ûù They are that bad. Some things you just don‰Ûªt joke about or if you do then you‰Ûªre sick. I‰Ûªm sorry but I don‰Ûªt find ‰ÛÏdead babies‰Ûù funny at all. That card will go in the trash. I get that the creator wanted to push the envelope to make this an epic fun game but some things are just not funny and ticked me off.,2
"After a few months of this game. its just meh...the jokes get old quickly and even with the new packs. i feel this is a good game for new friends, but after a few rounds, thats it.",2
I've only used this game twice and most of my friends think it's cringy,2
Highly inappropriate.,2
Should be X rated.  We had to censor ours before playing a second time.,2
I do like the game but they send me a box with a bunch of double cards. so I am pretty much playing with half of the box instead of the whole thing. I had to order another box from the company.,2
This card game was really fun until I saw cards that promote anti-semetic jokes. NOT O.K.,2
We have owned Cards against Humanity for awhile now and I sent this version to s friend as a hostess gift (old college roommate).  I had been telling her how funny and sick the game is.  Was I surprised when it was so tame.  The cards were funny but nothing like in my version at home.  It was boring because we weren't laughing as hard as usual.  Not sure if people complained so much they PG rated it or what but I was very disappointed.,2
"These cards go too far. I bought online as a Christmas gift, but returned as soon as I saw what some of the cards said. Far too much sexual content. Not a fan of crude games. Guess the name should have tipped me off though",2
"It's an ok game.  It's like apples to apples if a couple of drunk perverted college kids wrote the questions and answers.  It is very cheap and generic in appearance, the cards kind of look homemade.  I played it once and gave it away.",2
"They took out some cards that a few people complained about and said were offensive. That's right. The game is supposed to be offensive, and the creators caved when someone *gasp* got offended.",2
Not much different from Apples to Apples except for the crudeness.  Wanted to like this from reading the reviews but everyone that played kept saying it's like Apples to Apples but with vulgarity added.,2
"Apples to Apples is kind of a lame party game to begin with. Making the responses edgy only helps it for a little while. The shock value is minimal and wears off pretty quickly. I played a game with friends. By the time we were done, I knew I'd probably never play again.",2
"People say this is so much fun. I don't really think it is. it's kind of lame, loaded questions is way better",2
"We bought this game due to its popularity and because my friend group is always big into new card games or board games. We are big fans of the Apples to Apples card game, which works the same way but is not targeted to adult audiences. I was excited to try this card game since it allows for more salty content and unpolitically correct hands. However, after opening the card deck and reading the phrases, I was very disappointed at how blatantly vulgar and sexual most of the cards are. It seems far to forced and doesn't allow for the fun and nuance of making your own jokes by the choice of card play. As a result, I've had it for over 2 years now and it has never been selected as the game to play. I'm almost a little embarrassed I own it.The construction quality of the card box and the card lamination is excellent, so really the bad review is about the quality of the content, not the quality of the construction of the game.",2
It is okay. I heard tons of hype about this game and it didn't live up to expectations. Some of the answer cards are just dumb and lack creativity. Reminded me of playing madlibs w a child trying to be funny.,2
"The product itself is good quality, but the content shocked me. This game is hilarious - a total hoot to play, but the raunchy content ruins it. This would be a great game if the designers would clean it up a bit. As it is, I wouldn't even play it with my teens. Adults only.",2
"Nice party game, but card contents are mainly based on American/British Culture and unless you are too familiar with that you spend half the game time on Google. Even after you are confused whether other players (especially Card Czar) gets your point and you miss some opportunities to match cards. Despite there are 250 cards in a deck, after playing 3 or 4 times it becomes boring. Overall 4 stars for Americans/Brits, 2 stars for foreigners.",2
"I'm not a prude and really expected this to be hilarious. Some cards were; however the majority, in my opinion, were just plain mean!",2
"It is a fun game, the first two times that it is played.  After that, the shock value wears off and it is repetitive and drab.  Much like a boat, it is better to know someone who owns it, than own it yourself.",2
I get it. I really do but it wasn't as much fun as we thought it would be. We laughed but we've not picked up the game since playing it the first time. Not out favorite.,2
"This is the kind of game that's cool and interesting the first few times you play it, but gets very dull once you've seen most of the cards. The expansions attempt to keep it new and fresh, but there are so many other party games I recommend over this one. I guess it's fun to play with people who have never played it, so you can see their reactions to the cards. But that's about it.",2
"It relies on shock humor, but gets old after a few hours of playing",2
"Ok game to play a few times.  Gets old fast though.  Fun but WAYYYY overrated, don't expect too many playthroughs. Impossible to buy used or sell thanks to Amazon policy on this game.",2
"Though I was aware this game was a bit ‰Û÷risky‰Ûª, I didn‰Ûªt care for it‰Ûªs bold profanity. Just too offensive for my taste.",2
Game isn‰Ûªt for me. It is funnyish. But crude and not funny enough to overlook.,2
"Everyone was speaking about this game, and I didn't like it. It is just boring, sometime funny, but really you need alcohol to play....",2
"I anticipated irreverence and tastelessness, but I thought the game would allow for much more creativity. Instead, it opens up the opportunity to express dark, but rarely funny responses; hatefully good fun? The problem is that the game doesn't leave any room for a deeper engagement, nor does it allow players to inject their own humor. The mechanism disallows players to be accountable for espousing potentially horrid personal views, as they are prefabricated.By design, 'Cards Against Humanity' can't be funny, anymore so than can any  humor algorithm; it's just  too arbitrary. Playing is like being forced to watch poorly scripted television comedy of the 80's; the game plays itself.It's a dreary spectacle.",2
Lots of fun,2
Game is awesome but I'm giving it a 2 until I can get a new one mine had a bunch of doubles,2
Concept is good but the game is too subjective.  You need the right mix of people to make the game interesting.  Without the right mix the game does not stand on its' own as entertainment.,2
It is a good game but you need certain people to play it with. This game is not meant for everyone,2
"Eh, I've played this game with 3 sets of people and no one is liking it. It's boring high school humor.",2
"We played with another couple. We were all excited about the reviews, but we're very disappointed and found some of the question/answers stupid",2
"Brought this to work, was pretty fun the first time after playing like 15 rounds. Second time we played, it got kinda boring. I dont for see much replayability as the cards come up again and again.If they added more elements to it, it would be better. Other than just choosing answers and ending the actual 'playing' there",2
Less than stellar.,2
Couldn't possibly be fun unless you're all high on mushrooms or cocaine. Even with a fair amount of drinking I found this 'game' to be pretty boring. Nobody else seemed to be having as much fun as other reviews seem to imply. I guess to each his own.,2
Not worth the money I spent. Played it once w friends. Once was okay. Wouldn't rush to play it again.,2
Funny game first couple times you play but quickly gets old. There‰Ûªs a ton of expansions to the game but I haven‰Ûªt used any. Not for the prude or faint hearted. Most of my friends have all played it and the fun is worn out,2
Good,2
Thought it would be funner,2
Not what I expected.  Wanted to return it but didn't want to pay the fee.,2
"Great game , many of the cards came dirty , very disappointed",2
It looked new but the cards were mostly tore up. It was a Christmas present so by the time it got used I was unable to return,2
This game is Just o.k.  Definitely did not live up to all the hype.,2
"I don't get what the hype is all about. I didn't giggle as much as I anticipated. Fun, but... Meh.",2
"Is this what the world has come to?!Utterly banal and filthy. My adult son ordered this game. He has free will, but I let my feelings be known. I cry for our human race; for our children.",1
Too much for a family game.  Didn't realize how across the line it would be!,1
"a 13 yr old meth head might think it is funny, I just cringed and didn't laugh much.",1
"If you are 18 and drunk, this game is for you, otherwise, stay clear.  I found the cards distasteful, embarrassing, and totally classless. I'm shocked and disgusted that so many people gave it high marks.  I bought it for a 22 yr. old who felt violated when she read some of the cards. I really messed up buying it as a gift!",1
"It‰Ûªs just not very funny, compared to Relative Insanity. (Just wrote a review of that‰ÛÓ5 stars.) The cards that are funny are also grossly filthy, and I‰Ûªm no prude. I played with 4 other people, all in our 60‰Ûªs, all well-educated professionals. We were trying to figure out what demographic it would appeal to. Too many of the cards were just ‰ÛÏduh‰Ûù stupid, or extremely serious. What can possibly be funny about ‰ÛÏChild abuse‰Ûù ??  I bought Relative Insanity for someone else as a requested gift. I bought CAH at the same time just because I had heard so much about it. I am sorry I wasted my money. I‰Ûªll buy Relative Insanity for our game nights, and am seriously thinking about returning CAH because it is just not that funny.",1
"With five stars and over 30,000 reviews I thought we had a hit.It was a bust. Definitely NOT what I thought it would be.I hadn't bothered to actually read the  reviews. I know, rookie mistake.In order to play this game we would have had to edit a good percentage of the response cards due to vulgarity and inappropriateness.Of course, the box does specifically say it is a game for horrible people.  But that was a joke, right?Thanks Amazon, for having a generous return policy.  We'll stick with What Do You Meme?, Jack Box, and Exploding Kittens.",1
"I read the reviews, and I heard people say this was so fun.  The group of people I wanted to use this with includes two teens.  One of the reviews said they took out the cards that referred to God---one was'the blood of Christ'--2 referred to Jews in an antisemitic way, the rest were about sex mostly.  Well the idea is a great one but the authors must get their heads out of the can.  I decided to through it away",1
Game was open before I got to open it isn't  this a new game? I am super pissed now.,1
"The only thing I recommend to do with this game is throw it in the trash where it belongs.  It should be XX rated.  The sexual innuendos go too far,  sexual abuse, beastiality, unheathy sex and much more.  My family loves board games but when we gave this a try we all reacted with thumbs down.  Should only be sold in adult book store.",1
I was really disappointed!,1
"Should of read the reviews before buying.  Had hoped it would be fun for everyone but found it offensive and disgusting.  Do not understand why you could not make it funny and interesting without discussing rectal penetration, etc.  Very offensive to this old lady but the men love the game.",1
"This was  a waist of my money,  worse game I've ever played! Had 6 people over and everyone hated it!!",1
Not for kids at all under the age of 21,1
There are anti semitic remarks in it. Target has recently taken this game off of its shelves. There is a jew pack. It is disgusting and we should ban this.,1
Horrible game.  Part of our deteriorating culture.  And I have a rather dark twisted sense of humor but please don‰Ûªt buy the products.,1
Had some pretty offensive cards,1
It is filthy. Had no idea or wouldn't have made the purchase.,1
waste of money,1
I like a little naughty humor but this has way too much offensive content like child molestation.,1
Thought this was a different game.  This game is not much fun and kind of corny.,1
Not good,1
I lost interest after new details came out.,1
Some of the cards were printed hazy and others almost blank. Had to throw them away.,1
My box came damaged,1
This item wasn‰Ûªt in the package! Package was empty !,1
Love the game... box came in damaged and bent up...,1
"The game itself is awesome. But when it arrived the card box was sticky and when I opened it, it had mold growing it!",1
"I received a salt and pepper shaker instead of the game. I don‰Ûªt know how that happened. Lol. I thought it was a joke package at first but sure enough, it was an empty salt and pepper grinder.",1
Can't really leave a product review since my bag was empty! No game was included.,1
Game is great but there are spots on a lot of the cards that look like blood or rust and some of the print is rubbed off the back of several of the cards. Very disappointed for what I paid to receive something like that,1
The order I received is not version 2.0. It is version 1.7.,1
"Was just a virtually an empty box.  There were only blank cards with very few other cards included. The item was presented as you were getting the actual game, but Bam!  Empty box _ÙÒ_",1
I only got 23 black cards in my set.,1
"If I could give it a zero I would. Was told by a friend it was a fun family game. Our whole family was disgusted by the racism, anti-Semitism, sexism in what is supposed to be humorous. It‰Ûªs hard to disgust all of us:  we are a family where some vote Republican and others Democrat and others have their own ideas. We are Catholics and Jews and spiritual but unaffiliated. We are liberals and conservatives. We range in age from 70 to 3. After we read the supposedly funny questions we felt like we needed a shower. The game went in the trash can.",1
Package arrived empty,1
Apparently we are not ‰ÛÏwith‰Ûù it ... many of these cards would even make my beer drinking golfing buddies say this is not appropriate.,1
"This seems to be an updated version of the one I played many times several years ago. Enjoyed it playing it so much I wanted a deck for myself. However, this one contained many obscene cards that I was deeply embarrassed when I introduced it at a party I recently held. I had no idea these cards were part of the deck and was mortified when one was selected by one of my guests.  I know these cards were not a part of the previous deck I played with. Why was it necessary to add these tasteless questions? I am not a prude and enjoyed the deck I played with before and the occasional 'suggestive' questions. But these went way over the line. Very disappointed.",1
Received an EMPTY BOX very upset,1
"Ask around/ read reviews FIRST. My own kids were somewhat appalled that I ordered these. I thought the could be fun. COULD BE if it wasn't so vulgar and representing the worst in our culture. When I read the reviews I realized why and requested a return. Plus, nearly everyone says this gets boring after 3 games. No need to waste money contributing to the deliquency of my own soul or society.",1
"Repetitive cards, should have returned it but didn‰Ûªt realize it till it was too late.",1
