post,tags
"If you enjoy Apples to Apples and are looking for a game that can be very risque at times you'll probably really enjoy this game!  It is very similar in play style to Apples to Apples.  One person is the judge for a round, and gets to pick which answer is the winner, just as in Apples to Apples.  However, instead of simply matching one word to another, usually there is a sentence with one missing word and each player (aside from the judge) inserts their choice into the sentence.This is a great party game if you can gather up a lot of friends who aren't easily offended.  I played this the first weekend I had the game with six other friends (which I think was a good number to play this game).  We were planning on playing other games as well that night but we ended up playing this until about 2:00 in the morning instead.  This game provided all of us with MANY laughs that night.  Ever since the first night we played this my friends' have insisted that I bring this game.The only downside to this game is that it doesn't have near as many cards as Apples to Apples does, so once you play it a few times you'll make it through all the cards.  Personally, I still think it is well worth the $25 for the amount of fun that can be had playing this game.  They also offer several expansion packs for $10 each that include more cards.",5
"I broke down and purchased this for ourselves after playing it at friends parties. It is great for game nights at the house with our neighbors, or for making Christmas/Thanksgiving just a little more risque! I played this with my sister, sister in law, mom, and dad and we were all blushing at least once during the game! So much fun!",5
"Riotously funny card game.  The players are dealt out white cards with responses.  They then take turns reading the black cards, which have mainly one but up to three blanks on them, like the old Match Game from the seventies.  The other players offer their best response and the reader of the black question card selects the funniest.  The player giving that answer scores.  The game itself is very simple, but there are endless combinations of questions and answers, and that is where the fun is.",5
"I picked this up since my family loves to play games like Munchkin, apples to apples, quelf, ETC.I knew what I was getting into but they were in for quite the surprise. It turns out we played through the entire deck the first time we played. it took us about three hours to complete this.The first time we played this we were sober, the second we were not.Well, you know what time it is. PROS AND CONSPros:1: Quality: The cards are of a good quality. similar to high quality playing cards.2: Quantity: there is an absurd number of cards in this game. It took five of us three hours to play through all of the cards.3: comedy. Hilarious, I won't spoil it for you guys but these cards will have you bursting out laughing the second you read them.Cons:1: they aren't water proof?Other thoughtsI really couldn't think of any cons but I didn't want to leave it empty.If you are easily offended you might not like this game. But if you have a sick sense of humor or even just a little odd you will love this.",5
"A great adult game to get to know your friends like you never thought you would! This is a refreshing change from computer or console games and is a great party game among adult friends. Some of the questions may be a bit.. um... uncomfortable to play with your parents even as an adult. It's definitely not meant for kids! No subject is off limits. If you're find with any topic, then this game will provide a ton of entertainment and laughs.There's not a lot of time consuming instruction to learn and really, no one cares who wins. It's all about the entertainment of the fill in the blank answers. You don't even have to reveal your true self since you're answering with cards based on what you think someone else will choose as their favorite answer... so anything goes!After playing a few times, you'll want to  get the extension cards since the cards tend to be very memorable! Fortunately there are many additions you can get to add to your game!",5
This game is so not politically correct that it's a breath of fresh air!!  Yes there are some pretty shocking and disgusting cards in there so please pay attention to the age requirement on this game.  Plus if there is someone that you know that gets easily offended that this game is NOT for them.  Every time I play this with my friends we laugh so hard.  It's especially funny if you are drinking alcohol (please be over 21 if drinking alcohol).,5
"Price: 25 bucks for the original version. Don't pay a penny more. You can even order it direct from the manufacturer at the same price.Audience: Adults only. Don't bring this to Thanksgiving dinner or work. You cant find this at Target, because they don't want people to mistake this for a kids game. If you don't like racy humor, you probably will not want to get this, but if you do... you have struck gold!The game itself: Priceless. I had never played this before and brought it over to a good friends house. After a few beers we unsealed the game and took it for a spin. Its ridiculous in so many ways. All the cards are somewhere between hilarious, absurd, crude, sexy and 'what just happened'. The value in hearing your friends read some of the cards out loud is worth every penny. We were laughing so hard we were crying almost every round.Longevity: You're not going to play this every weekend, but if you break it out every few months: its an absolute riot. I plan to order the next expansion pack. I just wish it came with a bigger box to store all the cards together.Like I said, It plays just like Apples to Apples, but all the cards are winners. So: If you like crude jokes and you're over 18, Buy it! Just don't play it with your mom (unless your mom is more fun than you are, in which case, have at it) BUT if you don't like that kind of humor, you really should NOT get this. And don't buy this for your kids.",5
"This game is extremely fun and a great party game! I bought the original set and the Extension Pack 1.The object of the game is for the 'player-in-charge', which rotates each round, to put down a card that often has a blank that needs to be filled in. Each player puts down a card that they feel best fills in the blank and answers the question, as well as what will appeal to the 'host's' personality the most. The host doesn't see who puts down what card. The host picks their favorite response, and the person who put down that card gets to collect the host's question card. The person who collects the most question cards wins.Many of these questions and answers are 'dirty', or not PC, so it is not a good idea to play with someone who is easily offended. The more players you have, the more fun the game is.This game is a study in character. You have to know something about each of the players' personalities and what types of responses would best appeal to them if you want the best shot at winning!",5
"DO NOT PLAY THIS GAME UNDER ANY CIRCUMSTANCES if the following apply to you:1. You are offended by profanity.2.  You are offended by vulgarity.3.  You are offended when people do not adhere to proper PC terminology.4. You are easily offended in any manner at all.5. You lack a sense of humour.This game will cause you to look at your friends and family in a whole new way.  This game has been played now at several family get-togethers (we're all over 25) and it's been both illuminating and disturbing.  There are cards that I felt horrified to have my mother read aloud.  There are cards I was even more horrified that my mother played.  There were cards I was horrified I even thought to play.  In short, this game is absolutely horrifying..,.in the best possible way. I can't remember the last time we laughed so much playing games.  Throw any kind of decorum out the window because this game will lower you to your most anti-PC self imaginable.  You will perpetually feel like a terrible person the whole time you're playing, but it will be worth it in good times and hilarity.",5
"As long as you are playing with people that you know that won't be offended by anything that may come up in the cards, this game is great.  There are several times during a game that you will laugh until you nearly cry.  The only negative is that some overly sensitive people may have some issues with statements on cards.  This is an adult only game.",5
"This is a fun game. Warning, if you are easily embarrassed or conservative in any way, this game is not for you.Listening to you parents, siblings, friends, or other relatives say 'Panda Sex' or 'Doin' it in the butt' can be hilarious for some,but not so much for others. By the way, those are far from the worst things you will hear. I kept it nice here. Figure out which kind of person you are. If that seems like something you would want to hear, then buy the game. If you do not want to hear grandma or someone else say such things, then stick to Apples to Apples.We used to cross out and write our own Apples to Apples cards to make it more depraved. Then this game came out. Well that just made me sad, I could have been rich. Damn it! Well I am sure I am not the only one who did it, but don't have to do it anymore. Our friends at Cards Against Humanity LLC took care of it and continue to put out more and more, sicker and sicker cards for your gaming pleasure.",5
"First off, I'd like to say that I'm a nice person.  I try not to be prejudiced, mean, or otherwise demeaning to other people.  It's just how I roll.  That said, sometimes you just have to turn off the filter and let 'er rip.  Find a group of like-minded people who are willing to be raunchy, mean, nasty, and generally un-politically correct and play this game.  As long as 'what's said in the game, stays in the game', this game is fantastic.The premise is simple.  One person draws a black card with a question on it such as '____.  Kid tested, mother approved.'  Then, from a hand of 10 white cards, choose the 'best' answer to the question.  Your answers can be as benign as 'Peanut butter', 'thermonuclear war', or 'Rolando, Flatulist to the King' or non-PC such as 'Black People' or raunchy as 'Warm, velvety muppet sex' or even worse.This is where the game really shines.  The 'Best' answer is voted on by the person who read the question.  So if you play to your audience, you'll often 'win' the round.  The reader may not care for raunchy sexual innuendo, but may love ironic wordplay.  Or the person could be a flaming racist.  It's totally up to the reader what constitutes a 'winning' answer.  And while a lot of the cards are pretty horrible, there's many many many 'clean' answers that, when taken in the right context, are horrible in their own right.  And virtually every combination you come up with will be hysterical!This game is absolutely *not* for children, the closed-minded, or anyone who can't temporarily turn off their moral filter for a little while and just have fun.  If you enjoy just cutting loose with like-minded people and letting it all go crazy, then this is the game for you.  And, of course, a little alcohol goes a long way towards improving the quality of the play.  Make sure you get the expansions, too, as more is oh so much better.",5
"This is a really fun, adult game!  We like to host regular game nights and sometimes they get pretty ugly (even dominoes gets nasty!) but Cards Against Humanity has become a crowd favorite because everyone has fun and no one is a target.  It's super fun, dirty, and we like to make up some of our own house rules, such as if the Card Czar has a great card, they can play it for the comedic value to the group, but can't award points to themselves and cards are allowed to be re-upped upon a group decision.The cards are hysterical and the directions are a riot.  If you have a sense of humor and a few like-minded friends, you need this game!",5
"CAH is a classic game that everyone should appreciate.  As you've read, the game is to be enjoyed with a crowd that's open minded and can laugh at inappropriate subject matters.  I've purchased several of these sets for new home owners to help them create fun memories with friends in their new space - this game certainly provides ample material!",5
"I just love this game. As a bit of background, I am liberal in my political stance but pretty conservative in my everyday life, especially in the words I choose to use around my kids and in public. I rarely curse, ever, even with very mild words. But this game - when played with the right group of people - has given me the ability to let loose a bit and relax. I've played with couples of mixed races and gender combinations, as well as on a weekend girls' trip and it was an equally big hit. I DO feel like a terrible person sometimes when I give certain answers, but as long as everyone in the group understands that it's all in jest, this can be easily overlooked. Do NOT play this game with people who lack a sense of humor or who are ultra-conservative, politically or religiously.I have friends who play this with their adult parents or teenage kids, but I can't imagine myself doing so with either. And if you're a conservative parent, keep this out of your kids' reach; we attempted to play Pictionary with our neighbors one night with these cards (harder than it seems) and my 7-year-old walked in and picked up a black card, then started giggling, hard. I panicked before I saw what it said: 'My ex-wife', which is about as mild as any of the words on these cards get. We now keep them far out of reach and sight.",5
"This was Number One on my daughter's wedding register  List..Of course I do not understand that but she and her future husband love the game so I bought it for them. I will get them started and then they can go from there. She tells me this is the game to have when young people get together. Well, I want her to be happy and they can always eat off paper plates. LOL. I DID not open them and would not know if they are Original Manufacturers condition. They were listed as New.  I know the bride and groom will be very happy.",5
"Who doesn't love Cards Against Humanity! This game is a lot of fun! I enjoy playing it at college with my friends and at home with my cousins. This is not what I would consider a family friendly game, I have played with my mother, aunt, grandmother and cousins once and it was top four most awkward moments in my life. This game should be stuck to with people of the game ages or just not at family functions. There are some of the cards that make me feel uncomfortable but I usually set them off to the side and return with play. Many of the cards are very provocative or inappropriate and do not list the definitions of words. This is sometimes helpful but also a little uncomfortable when you have to look up the meaning of an awkward phrase, sometimes you get more than you bargain for.",5
"This game is so much fun.  I played it with 3 generations family last weekend.  I've been fearful of us drifting apart.  Usually the adult nephews are bored and ready to bolt.  Everybody has to be 'someplace.'  I had reservations about playing this game w my mom and her grandsons so I pulled maybe 30 of the most 'horrible' cards but after about 20 min I started shuffling them in.  We as a family haven't laughed and enjoyed each others' company in a VERY long time.  After 2 hours flashed past more than one face hurt from laughing.We like to think highly of ourselves but by the end the consensus was yup, we really are horrible people.  Funny but THAT bonded us.  Looking forward to Thanksgiving and I'm not the only one.",5
"This is recommended for ages 17+. I brought it to a family dinner, knowing that the two kids, ages 11 and 14, would vacate to the basement after dinner to play on their computers. The somewhat precocious 14-year-old overheard that I had Cards Against Humanity and made it clear that while he had never played or even seen the game, he knew enough about it that he wanted to play if his parents would give him permission. They did, and what ensued was hilarity, but even better, it opened channels for discussion about sex, politics, justice, racism, homophobia and all the things that exist in society, and when things are funny and when they are not. What made breakthrough shows like South Park and The Simpsons funny when they premiered was their seeming inappropriateness, but they too broached topics that ought to be discussed by parents and children. In an age when information is available 24/7, along with misinformation, this may be the opportunity for families who value open discussion, education and critical thinking to open the door to those discussions. There's so much for parents to teach to and learn about their kids, and to a degree, vice-versa. It's not for everyone, but this family found it hilarious and vital. I wish there had been a way to have these discussions with parents or another responsible adult when I was a young teenager and had to find out what I could from a 1957 Encyclopedia Brittanica and a Webster's Dictionary.",5
"It's fairly common knowledge that this game is very offensive. So if you're easily offended, it's a no brainier that this is not the game for you. Lots of sexual cards, a bit of Holocaust 'humor' cards, and there are even a card or two in there mentioning pedophilia. My husband has a pretty obscene sense of humor, but even we had to take out some cards (mostly the pedophilia cards, and he doesn't like the ones mocking God or Jesus.) The game is amazing, though, so it's not really a big deal at all to toss 5 or 6 cards that go to far for us. There are PLENTY more to chose from that are still ridiculous and entertaining, especially if you go into the expansion packs.All we have to do is mention having this game at a party or get together and immediately dozens of hands fly up when we ask if anybody wants to play, or tons of 'I WANT TO PLAY!'s are shouted at the simply mention of having the game. It's especially entertaining to play with normally more reserved old ladies... because then the truth really comes out, and you find their just as disgusting a person as you are haha",5
"Ever wondered what a grown-up version of Apples to Apples would look like? Well, Cards Against Humanity is the perfect response to that desire.If you've never played Apples to Apples or Cards Against Humanity, let me fill you in on how CAH works. There are Black Cards and there are White Cards. At the start of each round, one chosen player (The Judge) will select a Black Card from the stack. On these cards will be a phrase or question that needs to be answered/completed. This is where white cards come in. Players have 10 White Cards, which they use to complete the Black Card's question(s)/blank(s). After each player (besides The Judge) has chosen the best White Card in their hand to go with the Black Card, all players turn their White Cards in to The Judge. From here, The Judge reviews the White Cards and decides his/her favorite pairing of the White and Black Cards. The player who played the Judge's chosen White Card gets a point (if that matters to your group) and the gameplay starts all over.Let me give you an example with word-for-word examples of what you'll find on the Black and White cards.1. The Judge plays a Black Card that says: 'Life for the Native Americans was forever changed after the white man introduced them to ____________.'2. All players (exc. the Judge) choose a White Card.3. After everyone has chosen their White Card, the Judge reviews the responses: 'Smallpox Blankets', 'Drinking Alone', 'A Can of Whoop-Ass', and 'Take-Backsies'(Before you read these and think I'm an awful person, these are actual White Cards that I have seen played on the aforementioned Black Card)4. The Judge chooses 'Drinking Alone' and the player who picked this White Card wins the round.This game is great fun, but keep in mind that there are some edgy/racy/raunchy/explicit/graphic/vulgar White and Black cards. In fact, that's the point.If you don't have the right sense of humor to laugh at a card combination like 'Lifetime presents: __Pretending to Care__, the story of __Not Giving a S*** about the Third World__', then this is not a game that I would recommend for you.This is not a children's game, and this is not a game to play with Grandma (unless Grandma has a really effed up and awesome sense of humor). But if you and your friends enjoy laughing at the darker side of life, art, and pop culture... This is the perfect game for your next party.",5
"I've been hearing so much about this game, and I love opportunities to do things together with a good group of people.  So, I finally decided to buy this game.  It was everything I hoped and more!  The rules are fairly simple, and it didn't take long for the group of us to understand the premise of the game and then to truly embrace it.  The game doesn't tell you when a person has, 'won' so we decided after playing for over an hour that we should stop when someone reached 10 points.  We had a small group this time, just four of us.  And because it was our first time, we didn't use any of the recommended variations to the game.  And I don‰Ûªt currently have any of the many expansion packs.  The rules are simple, find the best (or worst possible) words to fill in the blank for a phrase, or to answer a question.  The power to decide who provided the best answer is in the hands of one person and it rotates each turn.  There are lots of possible answers, and a decent amount of ‰ÛÏquestions‰Ûù which is where I think all of the expansion decks must come in handy.  The cards are the same stock as a good set of playing cards.  So, that makes shuffling them fairly easy to do.  In all, it was definitely worth the money and I can‰Ûªt wait to play again.  We even had a laugh over the inspection tag that was located in the box.  It‰Ûªs NOT your standard tag.  I‰Ûªm already planning a get together so I can get friends together to play.  I paid full price for this game, and did not receive any discount.  These are my unbiased opinions.",5
"If you like to laugh, and you don't take life too seriously then you will likely enjoy this game.  If you are the type to be easily offended I would RUN, because this is likely the most offensive game you will ever play.  I mean the name 'Card's against humanity' kinda hints at that though.  You will feel like you need a preacher, some holy water, to wach your mouth out with soap etc. after making some of the choices you make in this game.  You will feel even MORE guilty laughing your BOOTY off at it.  It's wrong.  Oh so wrong....yet so right.  You learn a lot about a person's humor when playing this game.  That is part of the concept actually.  If you are good at reading people you will quickly learn the patterns of a person's decision making.  Some people like to choose the 'best fit', some like to choose anything that has to do with bodily functions, Some like to choose the most random answer possible and some will choose anything that has an animal involved.  You will learn this about people (hopefully) and be able to customize your 'answers' to give yourself a better chance at winning.  That leaves me with the 'CONCEPT' of the game.  It's pretty easy.  Everyone gets a set number of answer cards that they do not show anyone.  Then one at a time someone will read a question card.  everyone (other than person asking the question), is then to put down the best answer to that question from the cards they have in their hand.  The person who asked the question then reads them all out loud (this is where you will CRY laughing at some of the answers) and then selects which card they feel is best.  Whoever placed that card down gets a point.  Most points in the end wins.  Simple, silly, fun.  Don't play with your grandmother unless she is a dirty, dirty lady ;-)The box is small so it is an easy game to bring to a party or on vacation.  It is easy to store away and pull out for an instant drinking game and fun time (with the right crowd obviously).",5
