post,tags
"Every decade we come across a board game that takes the world on fire, which is a difficult thing to do in this world full of video games and instant gratification.  This decade's board game is Cards Against Humanity, an adult version of Apples to Apples.  While the kid's version can be just as entertaining, CAH is a clearly more adult version with references to sex, drug use and bathroom humor.  This game is A LOT OF FUN with an ADULT crowd with a sense of humor.  But as we live in a world of uptightness and hearing the wrong things, PLEASE exercise caution when playing this game or even referencing this game in conversation to others.  Quite honestly, my sense of humor is not always geared towards sex, drugs and bathroom humor, because I think it's a sign of intelligence to show you do not always need to reference those things in conversation.  But I do enjoy a good sex, drugs and bathroom humor joke like the rest of them.  Have fun.",5
"Warning!If you are religious, innocent, sheltered from the secular world, easily offended, or a goody-good, this game may not be for you.Are you already a horrible person?  If not, then be careful, you might have become one, after playing this game.End of Disclaimer.Cards Against Humanity Review:As it says on the box, this is 'a party game for horrible people.'  If you are already horrible, then go ahead and play. Have fun!  If you do not feel like a horrible person while you are playing, then you are probably not playing it right.- This game is basically Apples to Apples, but with horribly funny things on the cards.  This is my favorite party game.- It is so easy to play that you don't have to explain any complicated rules.  People at a party will watch one round and then want to join in.- Anyone can leave or join the game at any time without disrupting the flow. So if people arrive to the party late or leave early it is no problem.- If someone gets up to go to the bathroom or to make a drink, then the game can go on without them for a few minutes.  (I guess if you are good people, then you would wait for the person to come back so that they don't miss a round, but if you were good people you would not be playing this game.)- Again, the game does not have to stop for the remaining players as some players come and go.So if you are looking for an awesomely fun, hilariously offensive party game for you and your horrible friends, this is it.",5
"Good luck not peeing your pants while playing this game! Awesome to play with friends and surprisingly hilarious to play with parents/aunts/uncles/etc. It‰Ûªs super inappropriate and incredibly funny. This is also a great game for a group, whether long term friends or new acquaintances. It‰Ûªll break the ice for sure and it also easy to pause for snack/drink refills.",5
"Are you a horrible person?  Terrible?  Do you mind reading strange and offensive things that would never be allowed in a 'proper' conversation?  This is the game for you!  Consider it Apples to Apples for adults.  Granted somewhat immature adults but adults none-the-less.  You have Black cards and you have White cards.  The Black cards have a few words, sentience with blanks, or instructions that then must be filled in by the White cards.  And using the White cards to fill in the gaps in the Black cards will likely get a few reactions, for example:  'We are awful human beings.'  'We are all going straight to hell for this.'  'OMG!'  etc, etc.  Point is: your not going to be sure if it's appropriate to laugh, but your will be laughing just to break up the awkwardness.  Fun game, highly recommend it, but again only for terrible, horrible people.  Like me.  Thanks for reading and have a nice day.",5
"I got this game for my teenage brother for christmas a couple years ago and my fiance, myself and my brothers played it that day and have done so a few times since. It is a great game because it really brings out the dark side in people and encourages a level of non-political correctness that is okay in few other places. The game comes with a good amount and variety of cards and the rules are clear and easy to understand and follow. There is not a lot of complications. The box and cards themselves are high quality. While the price for this game is a bit high, it is a highly unique game that is well throughout and well made and I believe it is worth the price. You are not going to find another game like this at your local Target or game store. One not is that this game is really not for kids and playing it with your parents/teenagers is probably not a good idea unless you have one of THOSE relationships...you know what I mean?",5
"We played this game for the first time the other night with four people.  Although there was drinking involved, I think we enjoyed the game so much that we were distracted from our drinking and actually remained sober the whole time we played.  We also had so much fun that we pretty rapidly forgot we were even keeping score.  I absolutely cannot wait until we play with more people because there will be more answers to decide between and choosing a winner each round will be that much harder.  As everyone else says, it is apples to apples, but x-rated.  It is absolutely hilarious, but even playing with one of the most liberal group of people I know, each of us was offended, or at least shocked, at least once.  However, we love the shock value, so that just made it more fun for us.  It would be very easy to decide to remove one or two cards because they toed the line just a little too much, but if you are going to do that, you really have no business owning this game.  If you, or someone you plan to play this with regularly are even slightly sensitive, easily offended (or able to be offended at all), or even just a really nice person with good morals, skip this game, it is pretty intense in it's vulgarity, and nothing is off limits.",5
"As my 28 y/o daughter said throughout her first time playing this game....'this is so not okay' and 'I'm going straight to hell'Definitely not a game for children or young teens or super religious people. But as has become our tradition to take a shot of Fire Ball Whiskey before we play the game. You know you've ventured into some things you have been thinking and some that you haven't ever thought of before! A great tension buster, a bonding game to say the least. We were introduced to this game during a family wedding weekend and although my 17 year old told me about the game a few days prior it's not a game you expect. Everyone asks 'have you played Apples to Apples before', (for me NO), it's off the chart hysterical, vulgar and creative. Think MadLibs times infinity and so politically incorrect!! We opted for the first two expansions because we played the 3rd expansion at the family get together. I thought just the original game itself was hysterically funny. We've made some of our own rules up....having 7 cards instead of 10 is easier to manage, and our next game will somehow encompass being able to play the re-up card beings that card always seems to be the perfect card for the question card that was just presented. I am not a crude person nor am I a prude this card game is a 'let your hair down and get comfy kinda game' Make sure you don't pee your pants.*****DEFINITELY NOT APPROPRIATE FOR ALL AUDIENCES******",5
"If you want the most despicable, dastardly, dirty, blunt, disgusting party game of all time, look no further. Every aspect of the game even including how the person who goes first is determined is raunchy. I first discovered this gem a couple years back from a co worker who constantly would get people to play on their lunch break. It soon turned into the ritual of many people at my work. Alas, I felt the need to own this and play it no matter where I go, so I bought it here. Obviously this isn't a game for children, though it will bring out your child-like wonder of awesomeness trying to come up with either the most heinous or humorous answer to the already outrageous questions. If you think the price is a little too steep for you, keep in mind that not only will this be a game that you can use as a unique conversation starter, but you can play over and over due to the sheer amount of answer cards there are. There's even expansions! So buy it. Now. Seriously.",5
"I haven't laughed this hard in years.  Seriously, we've played it twice, all the way through the box of cards each time and I cried both times.  Mascara running down the cheeks type of laughter, can't catch your breath and have to walk away from the table type of laughter.It's so simple.  There's a black card in the center of the table.  ('What did my grandmother find deeply disturbing yet oddly charming?')  Every one lays a white card, upside down on the pile.  Read the white cards out loud ('Tasteful sideboob.  Assless chaps.  Bio-engineered turtles with acid breath')  Pick the funniest.  Those are examples I can give without being seriously edited or feeling embarrassed for writing while at work.That being said, I'm probably going to be spending the afterlife in a very hot climate.  I don't know who created these cards, or who is paying them to write this terrible nonsense, but I imagine I'll meet them in Hades one day.  Do not play this game with innocent, happy people.  Do not play this game with your mother or your child.  Surely you know another horrible couple would enjoy some laughter.",5
Third time I've bought this game! Second time as a present! Love this game and everyone I've showed it to has wanted to get it! Awesome party game that you can play with or without alcohol and still have a great time.,5
"This is a great game that is easy to whip out whenever the conversation runs thin.  You gain a clear understanding of the subtle differences between your companions' senses of humor.  Some friends/couples/siblings will vote for each other every time and others will get into fights because they can't/won't play to each others' sense of humor at all.  The cards are well enough made that they can endure drunk handling.  I guess if you were going to be really fussy about them, you could get card protectors, but I say just give the CAH people another $25 if you are getting that much use out of the game.  It's true the 3rd expansion cards are of a slightly different make, but the quality is comparable and once you mix them in, you forget all about it.  The boxes are really HQ, so it's too bad you have to transfer the cards into a different box if you want to keep all the expansions together.  But, the BCW 660 Count- Corrugated Cardboard Storage Box is the perfect size for 3 expansions, and it fits compactly in a small backpack or satchel, which is handy.  As far as the different expansions go, I think the debates over which ones are good and which ones are 'trying too hard' or 'too gross' are pretty stupid.  Everyone is going to find different things more or less funny, so just buy them all and if you must, throw out the individual cards you hate.  There is no difference between the original cards and the expansions, IMO.  The rules have a variant where you can trade in a card for a new one, if you don't know what it means, (you just have to read it aloud to the group and admit your ignorance).  This is a GREAT rule, that everyone loves.  If you're worried about someone being uncomfortable with some of the cards, just let them trade them in (or wear them on their forehead, whatevs), and play on.",5
"The box says it's 'A party game for horrible people.'  It's not wrong.I played this for 'just a few minutes' at a gaming convention, where my friend Chris told me some people were playing it in one of the open gaming rooms.  He'd played it at another convention, and described it for me, whereupon I asked him to please grab me if another game started.If you've played 'Apples to Apples', you have a good grasp of the game mechanics.  If you haven't, here's a brief summary.  All the players have a hand made up of white cards.  As play passes around the table, one player lays his or her hand down, and takes one of the black cards, reading it aloud, and letting the others play one or more white cards to complete the sentence.  The player reading the black card then has to determine, without knowing who played each card, which one is the funniest.One card reads: 'I don't know what weapons World War Three will be fought with, but World War Four will be fought with (blank).'  The winning response was too appalling to list here...as is usually the case.  Expansions come out fairly regularly; expect to see 'Miley Cyrus' and 'twerking' in a future set.  If you can't wait that long, the expansions all have blank cards so you can write your own questions and answers.The game is *so* not for children.  In fact, anyone even slightly offended by real life should consider themselves warned to walk the other way when this game is out.  For everyone else, you'll be entertained, and more ashamed of yourself than you ever thought possible.",5
"No, really - the last time I played, someone actually had written 'your mom' on one of the blank answer cards in the set we were using.This is my favorite board/card game ever. I thought Apples to Apples was the best game when I first played that - and it still is, if you want to play with children or your mom - but if you're playing with the sort of grown ups who would make a Freudian joke *about* your mom, this game plays has the same basic mechanics, but much funnier (and more offensive) cards. This game is also all my friends' top choice for what to do at a convention when you're all wide awake but the events are over for the night. I decided that before the next con, I wanted my own set, and ordered this and as many expansions as the gift card I had handy would cover. Next time I take change to the machine in the grocery store and turn it into an Amazon gift card, I'm buying the rest!",5
"Very fun game! It's just like Apples to Apples but adult themed.  4+ players, with the more the better.  It is a great activity for friends or couples, something to do at parties or just when you have over a few humorous friends.  This is a card game, with each player having a number of cards in their hand with words or phrases on them , (such as 'genital piercings' or 'lactation' ).  The players take turns being the 'picker' when they flip over a descriptive card such as 'what you think about during sex' and then the other players put in one of their word or phrased cards they think best matches the description card.  The player whose turn it is to pick the winning card chooses which one out of the bunch submitted they think best fits or is the funniest.  The winning card gets the point for that round.  Its amusing because the game changes as each player gets the chance to be the card picker.  So you really have to know your audience.  I am a very literal person when I play the cards whereas my husband chooses purely off which ever card makes him laugh most.  So each time you play it is a different scenario.  Not all the cards are risky. If you have a good sense of humor and like adult themed jokes (slightly 'naughty') then this is a good game for you.  If you are easily offended by sex jokes and are strictly religious then try playing something else (Old Maid or Bingo perhaps?)",5
"I can't wait to buy the expansion packs for this game.  I simply love this game and could not wait to play it after playing it a few months ago with some friends.  BUYYYYYYYYYYY this game if you are looking for something new to play and something to keep you entertained.  Some of the white cards suck and are more so for someone who is conservative but the majority of the cards will have u realizing just how messed up, you and your friends are. I thought playing ring of fire was bad but this game takes the cake for being that game to know about how perverted or messed up you truly are. LOL.  Wouldn't recommend for anyone that is faint of heart or who can't take a joke. Def. not a game for anyone who is super religious because you will be asking for your money back. Other than that if you don't mind a twisted game that will you have your side hurting throughout then this is the game for you especially when you have friends over for a few drinks.",5
I bought it as a gift for my roommate and it's FUN... but still need to google some of the answers to understand the background meanings lol,5
"This is one of the best games ever. If you are one of those people that like puns, dirty jokes, or who has a slightly odd or off kilter sense of humor this is the game for you. The game offers a series of black and white cards. The black cards are similar to the old 'Mad Libs' games that everyone played as a kid where you have your friends choose words to fill in the blanks and the paragraphs often end up hilariously funny. Except in this case your friends or fellow players are given 2-3 white cards with phrases or words on them to fill the blanks on the black cards in with. Depending on the word combinations this can end up hilarious or absolutely horrible.People should be warned now. If you are seriously into political correctness, if you are sensitive and your feelings are easily hurt, or if you are in a professional setting than this is not the game for your. Cards are often about as politically incorrect as you can get, and sometimes they are downright mean.Otherwise have fun and enjoy because you will be rolling around on the floor laughing during the game session.",5
"FUN FUN FUN game to play with adults! Some of the cards are useless- hard to use so you end up with a handful of 'non-funny' cards so we play where we often do an 'exchange' of cards- but the game is great to play with new people! I've already ordered 4 expansion packs b/c you can only play the game about an hour or so before you run out of white cards or black cards and then it's not as funny anymore when you start playing down the same cards from before- SO, we are planning on playing again with about 6 friends this coming weekend, once my expansion packs come in the mail. I'm also going to take out the DOUBLE BLANK black cards as those are hard to play when you have a big group of friends playing. The best cards are the questions (EX: 'WHAT'S THAT SMELL?') or the single FILL-IN-THE-BLANK cards (example: '_______: Kid Tested-Mother Approved' ) with answer cards like 'Grandma' or 'Semen' or 'anal beads' LMAO  This game is definitely better played with about 5-10 people! It can be played with up to 20 but I wouldn't recommend less than 5 people and definitely no children as some of the white cards are hilariuosly VULGAR :) All-in-all, I LOVE this game- all my friends at the party were ranting and raving how they have 'GOT TO BUY THIS GAME'... They all can't wait for my new cards to come in the mail since we went through the entire box of cards in one night! I've heard the expansion packs are even better than the ones in the original box/game. So I'm excited... DO buy this game if you're into Adult Game Nights, drinking makes it funner but not necessary- Once I buy all the CAH expansions, I'll buy the Crabs Adjust Humidity card expansions too- HAVE FUN!!!",5
"Who Pooped Last? That's how this hilarious game starts out.  You have to start each game with a discussion about the last time everyone took a dump, and the one who pooped most recently goes first.  It goes thankfully-downhill from there.  This is a rude, crude, can't believe you actually said that out loud game, which is basically an ADULT version of the much-heralded Apples to Apples game.  You have black cards and white cards. The black cards are questions, and the white cards are possible answers that you offer to match.No one likes to keep score, so here's how we play it. When someone wins a round, they get to keep the black card in front of them.  That way, every player knows their own score.  We also found that using the box cover is a great way to capture all the submitted answers each round. The reader then pulls the cards out of the cover and shuffles 'em up.  (You do have to improvise a bit when a 2- or 3-part answer is required).We've had several long rounds of laughter playing this game.  People often start laughing just to themselves after reading the latest card they drew.  You WILL hear someone say, 'I just drew a card that was perfect for that last question!'There is a small drawback, though - but there's a solution.  The drawback is that you go through a LOT of cards, and part of the fun is the novelty of the answers.  There are several expansion sets, but even better would be to have everyone create a few new cards each time you play.  The cards against humanity website offers a really L-O-N-G box ($15) to hold all the cards you can create.  You can also print out the free sets that are out there (so what if the cards aren't all the same size!).  Just mark one end of the box as DRAW HERE so you cycle through them all.Get ready to laugh, with adults, of course.",5
"Funny? YesInappropriate? YesFun to play with your prudish mother who hesitates every time she reads a card? Ohhhhhh yeaaaaa...It is important to note that the creators of this game will allow you to print all their cards FOR FREE via their website, however who had the time for that? Take into account the cost of toner and that they won't have that 'card-like' feel to them and, well, you might decide that it's worth paying the folks who created the game.And it is totally worth it! Nothing says cheap like rolling out the faux-Cards Against Humanity. Pay for the set(s) and they'll use that to continue creating horrible updates for us horrible people.",5
"My family has played Apples to Apples for many years and now they are grown my daughter kept asking about Cards Against Humanity.  She could not afford to buy so I decided to buy along with the green, red, and blue expansion packs. Oh my, I have never been as entertained or embarrassed as I have been playing this game.  We laughed so hard for hours.  I will never look at family gatherings (or my children) in the same manner again.  Glad I bought the expansion packs with it, we would nearly go through the entire set in one gathering.",5
"As funny as a bunch of rabid squirrels! Oh, I'm loving this game more and more. If you have a dark sense of humor, And no limits, This game is for you. I've been playing it, And love it. The instruction manual is great too! Couldn't stop laughing.Hope you get it, If you have no limitations or can handle dark humor.I played it with my dad last night, And we both laughed so hard, We sprained our backs the next day. So sore, But it was well worth it.My dad nearly passed out laughing.The best that money can buy.",5
"Uhh have you been living under a rock? This is only one of the best party games you could ever play with a group of adults.  Oh you think your friends are mature? As soon as you drop this box on the table, all your friends dark and twisted sides come out real quick. You think to yourself, ‰ÛÏmy friends are pretty mature and I think I know them pretty well.‰ÛÏ Bring this game out and you‰Ûªll see just how twisted your good friends Karen and Steve really are.In all seriousness, this game is fantastic.",5
"After playing this game, I decided to build a bunker under my home.  If this game is any indication of the current state of humanity,  the great fall can not be far off.  I recommend buying as many guns and hoarding as much food and ammo as possible.  If you live in a city you need to GET OUT NOW,  you will NOT be safe there. Do not wait until our once great AMERICA falls, get to a rural area as soon as you can.  While it might be possible you could survive the on-coming apocalypse inside an urban area, your chances will far improve if you get to the countryside now before it's too late.And, If you live in California, I recommend leaving the state entirely, it's your only hope.",5
